title,author,categories,description,language,pageCount,averageRating,ratingsCount,publisher,publishedDate
Night and Day,Virginia Woolf,Fiction,"«¿Sabes que eres rara a más no poder? Todo el mundo me parece un poco raro. Tal vez sea el efecto de Londres». En el Londres de principios del siglo XX, Katharine, la nieta de un célebre poeta, se promete con William, un insulso escritor que ansía reconocimiento. Lo que William no sabe es que, a pesar de su legendario abuelo, su prometida prefiere, en secreto, el mundo preciso y exacto de las matemáticas al nebuloso y ambiguo de las letras. Mientras tanto, Mary, una joven y resuelta sufragista, se enamora de Ralph, un abogado de origen humilde que no puede evitar sentirse atraído por Katharine. Publicada en 1919, Noche y día, la segunda novela que escribió Virginia Woolf, nos muestra, a través del destino entrecruzado de estos cuatro jóvenes londinenses, las tensiones entre su libertad personal, sus sentimientos y los muros de clase que erigen las convenciones sociales de la época. «Una de las más grandes escritoras del siglo XX». The Guardian",es,492,,,Trotalibros Editorial,2023-11-08
Tarr by,Wyndham Lewis,Literary Collections,"'The nearest the general run get to art is Action: sex is their form of art: the battle for existence is their picture.' Tarr tells the blackly comic story of the lives and loves of two artists, played out against the backdrop of Paris before the start of the First World War - the English enfant terrible Frederick Tarr, and the middle-aged German Otto Kreisler, a failed painter who finds himself in a widening spiral of militaristic self-destruction. When both become interested in the same two women - Bertha Lunken, a conventional German, and Anastasya Vasek, the ultra-modern international devotee of 'swagger sex' - Wyndham Lewis sets the stage for a scathing satire of national and social pretensions, the fraught relationship between men and women, and the incompatibilities of art and life. In his introduction and notes Scott W. Klein explores Lewis's stylistic experimentation within the context of avant-garde movements in painting, and offers new insights into Tarr as a work of mordent wit and enduringly ferocious irony. ABOUT THE SERIES: For over 100 years Oxford World's Classics has made available the widest range of literature from around the globe. Each affordable volume reflects Oxford's commitment to scholarship, providing the most accurate text plus a wealth of other valuable features, including expert introductions by leading authorities, helpful notes to clarify the text, up-to-date bibliographies for further study, and much more.",en,378,,,Oxford University Press,2010-09-09
The Return of the Soldier,Rebecca West,,,es,165,2,1,,1982
The Shadow-Line: A Confession,Joseph Conrad,,,es,176,,,LD Books,1999
Summer,Edith Wharton,Fiction,A naive girl from a humble background conducts a torrid romance with an ambitious city boy in this sensational tale of a woman's sexual awakening by the Pulitzer Prize-winning author of Ethan Frome.,en,142,,,Courier Dover Publications,2020-05-21
Growth of the Soil,Knut Hamsun,Fiction,"""Growth of the Soil"" is a novel by Knut Hamsun which won him the Nobel Prize in Literature in 1920. The novel was written in the popular style of Norwegian new realism, a movement dominating the early 20th century. It exemplified Hamsun's aversion to modernity and inclination towards primitivism and the agrarian lifestyle. ""Growth of the Soil"" portrays the main protagonist, Isak, and his family as awed by modernity, yet at times, they come into conflict with it. The novel contains two sections entitled Book One and Book Two. The first book focuses almost solely on the story of Isak and his family and the second book starts off by following the plight of Axel and ends mainly focusing on Isak's family.",en,318,,,DigiCat,2022-11-13
Bunner Sisters,Edith Wharton,Fiction,"Adaptación a Lectura Fácil de la novela de Edith Wharton. Todas las personas con dificultades de comprensión lectora podrán acercarse a esta obra clásica y desconocida, pero que es un verdadero tesoro literario. Ana Elisa y Evelina Bunner tienen una tienda de costura en un barrio humilde de Nueva York. Llevan una vida tranquila y sin lujos y viven juntas en una pequeña habitación. Cuando compran un reloj en la tienda del señor Ramy no saben que sus vidas van a cambiar para siempre. Lecturia es una editorial especializada en Lectura Fácil, que pretende acercar la literatura a todas aquellas personas que tienen dificultades para comprenderla y para disfrutarla.",es,165,,,Lecturia Libros / Albo & Zarco,2023-10-13
A Portrait of the Artist as a Young Man,James Joyce,Fiction,"""Solo. Libre, feliz, al lado del corazón salvaje de la vida. Estaba solo y se sentía lleno de voluntad, con el corazón salvaje, solo en un desierto de aire libre y de agua amarga, entre la cosecha marina de algas y de conchas; solo en la luz velada y gris del sol, entre formas gayas, claras de niños y de doncellitas, entre gritos infantiles y voces de muchachas..."" ""Retrato del artista adolescente"" es el debut literario del escritor irlandés James Joyce. La novela, publicada como una serie en la revista ""The Egoist"" y vuelta a publicar, esta vez como libro, en 1916, es un ""bildungsroman"", o novela de aprendizaje, altamente influenciada por la propia vida de Joyce. Esta novela semiautobiográfica tiene como protagonista a Stephen Dedalus, y relata la infancia y adolescencia de un joven en contra de las convenciones de la sociedad burguesa de su tiempo. Se trata de un relato en tercera persona con una gran libertad y maestría en el uso lenguaje, creando pasajes similares al monólogo interior y otros totalmente libres, donde las palabras y la forma toman las riendas de la narración. La historia fue llevada a la gran pantalla en 1977, a cargo del director Joseph Strick y con Bosco Hogan (""El rey Arturo"", ""Los Tudors"", ""Los Borgias"") en el papel de protagonista. James Joyce (1882-1941) fue un escritor irlandés. Se le considera una de las figuras literarias más importantes del siglo XX. Su obra más famosa, ""Ulises"", a menudo se conoce como la ""Odisea"" del siglo XX. Sigue siendo una de las novelas más innovadoras de la historia de la literatura hasta el día de hoy.",es,292,,,Lindhardt og Ringhof,2021-04-14
Under Fire,Henri Barbusse,Education,"Robert Graves escribió esta temprana autobiografía en 1929, poco antes de tomar la firme decisión de abandonar Inglaterra para vivir permanentemente en el extranjero, y de hecho corrigió las pruebas ya en Mallorca, la isla de sus sueños, de la que no se marcharía nunca, salvo un breve periodo durante la guerra civil española y la Segunda Guerra Mundial. Adiós a todo eso, como su título indica, es una despedida, la rememoración de unos tiempos y unas experiencias dolorosos y amargos, con la voluntad de cerrar una etapa y renacer como un hombre nuevo en la sierra mallorquina. En las páginas de este prodigioso ejercicio de memoria, Graves repasa su infancia y sus infelices días escolares en el internado de Chatterhouse; sus brutales experiencias en las trincheras de la Primera Guerra Mundial, en la que sirvió como joven oficial y que le dejaría una profunda huella, su desastroso matrimonio con Nancy Nicholson, pero también su emergente vocación literaria y sus encuentros con escritores como T. E. Lawrence, Siegfried Sassoon o Thomas Hardy.",es,400,,,,2010-01
Rashomon and Other Stories,Ryunosuke Akutagawa,Fiction,"""Rashomon and Other Stories"" has had a profound impact on both Japanese and international literature. The stories ""Rashomon"" and ""In a Bamboo Grove"" were famously adapted into the 1950 film Rashomon by Akira Kurosawa, which brought Akutagawa's work to a global audience and won numerous awards, including the Golden Lion at the Venice Film Festival. Akutagawa's exploration of the human condition, his innovative narrative techniques, and his ability to capture the complexities of moral and existential dilemmas have cemented his place as one of Japan's greatest writers. His works continue to be studied and appreciated for their literary merit and their insights into the human psyche.",en,160,,,Lebooks Editora,2024-08-05
The Good Soldier,Ford Madox Ford,,,es,308,,,LeBooks editora,2025-03-12
The Voyage Out,Virginia Woolf,Fiction,"Son tan estrechas las calles que van del Strand al Embankment que no es conveniente que las parejas paseen por ellas cogidas del brazo. Haciéndolo, exponen a los empleadillos de tres al cuarto a meterse en los charcos, en su afán por adelantarles, o a recibir ellos un empujón u oír alguna frase, no siempre muy gramatical, de boca de las oficinistas en su apresurado camino. En las calles de Londres, la belleza pasa desapercibida, pero la excentricidad paga un elevado tributo. Es preferible que la estatura, porte y físico sean normales, con tendencia a lo vulgar; y en cuanto a la indumentaria, conviene que no llame la atención bajo ningún concepto. Una tarde otoñal, a la hora en que el tráfico empezaba a intensificarse, un hombre, que llamaba la atención por su elevada estatura, paseaba con una mujer prendida a su brazo. A su alrededor, y asaltándoles con airadas miradas, rebullían, como hormigas en su marcha incesante, una multitud de seres que parecían diminutos en comparación con la esbelta pareja. Esos seres insignificantes, cargados con papeles, carpetas de documentos y preocupaciones, correteaban pendientes de la obsesión de que su salario semanal dependía única y exclusivamente de su eficacia. Eso explica que miraran con poca benevolencia la excepcional estatura del señor Ambrose y la capa de su esposa, que se interponían en su febril actividad.",es,264,,,BoD - Books on Demand,2023-04-24
Of Human Bondage,W. Somerset Maugham,Fiction,"Of Human Bondage is a semi-autobiographical novel following the life of Philip Carey, a newly orphaned boy sent to live with his aunt and uncle in a vicarage. Somewhat of a social outcast, Philip finds it difficult to adjust to life in boarding school and while his uncle pressures him to pursue his studies at Oxford, he yearns for a life of adventure and romance instead. And so he travels and pursues whatever suits his fancy. After a brief stint in Germany, followed by studying art in Paris, Philip eventually falls in love with Mildred, a waitress in London with whom he ends up in a tumultuous, bittersweet relationship.",en,682,,,Amaryllis - an imprint of Manjul Publishing House ,2022-12-29
The Rainbow,D. H. Lawrence,Literary Criticism,"Focusing on D. H. Lawrence's concept of «essential criticism», which was introduced in his posthumously published «Study of Thomas Hardy» and his statement that «every work of art adheres to some system of morality. But it must contain the essential criticism on the morality to which it adheres», this book examines the ways in which Lawrence presents his ideas in his major novels The Rainbow and Women in Love. It explores how this concept plays a crucial role in his fiction as an «other» to the implied author's messages: functioning differently, as equivocation and creative strife, respectively, in The Rainbow and Women in Love, the concept helps to make these novels more dynamic that commonly realized.",en,186,,,Peter Lang,2005
The Thiry-Nine Steps,John Buchan,Fiction,"Aquella tarde de mayo, hacia las tres, volví de la City bastante hastiado de la vida. Hacía tres meses que me encontraba en la madre patria, y ya estaba harto de ella. Si un año antes me hubieran dicho que me sentiría así, no me lo habría creído; pero así era. La lluvia me ponía de malhumor, el lenguaje del inglés corriente me ponía enfermo, no podía hacer bastante ejercicio, y las diversidades de Londres me parecían tan insulsas como una gaseosa dejada mucho tiempo al sol. «Richard Hannay —me decía a mí mismo una y otra vez —, has caído en una zanja, amigo mío, y será mejor que te des prisa en salir.» Me mordía los labios sólo de pensar en todos los planes que había hecho durante los últimos años pasados en Buluwayo. Fueron muchos; no extraordinarios, pero sí lo bastante buenos para mí; y había imaginado gran cantidad de medios para divertirme. Mi padre me sacó de Escocia a los seis años, y no había estado en casa desde entonces, de modo que Inglaterra me parecía un cuento de Las mil y una noches, y mi intención era quedarme allí hasta el fin de mis días.",es,91,,,BoD - Books on Demand,2023-06-11
KoKoro,Natsume Soseki,Fiction,"«Una novela que se puede leer con gran emoción y gran suspenso, escrita con un virtuosismo formal impresionante». Fernanda Melchor « Una obra estupenda que reta al lector en múltiples niveles y se comunica de manera directa con nuestro presente » . Cristina Rivera Garza « Es una novela muy elegante. Un libro orgánico cuya lectura se siente muy natural » . Julián Herbert Sacada a la fuerza de su casa y llevada a la ciudad de Wurzburgo, Anna halberg deberá enfrentar un juicio por brujería instigado por sus vecinos y dirigido por un feroz inquisidor. Mientras permanece recluida en la torre de brujas, su marido y el sacerdote de la aldea harán lo imposible por librarla de la hoguera. Brujas, hombres lobo, espíritus familiares y hasta un demonio que teologiza se dan cita en estas páginas, pero su presencia es insuficiente para ocultar el verdadero horror; la inhumanidad de las instituciones y la maldad arbitraria que anida en el corazón del ser humano.",es,107,,,RANDOM HOUSE,2021-04-23
Locus Solus,Raymond Roussel,Biography & Autobiography,"Raymond Roussel, nacido en 1877 y muerto en circunstancias misteriosas en 1933, es una de las figuras literarias más irresistibles de todos los tiempos. Su poesía, sus novelas y sus piezas teatrales han ejercido una influencia significativa en la obra de muchos de los escritores y artistas más conocidos del siglo XX: Jean Cocteau declaró que era «un genio en estado puro», mientras que Salvador Dalí, que murió con un ejemplar de Impresiones de África (Siruela, 1990 y 2004) en su mesilla de noche, lo consideraba uno de los mayores escritores que Francia había producido. Duchamp, Breton, Foucault o Robbe-Grillet dan testimonio del indeleble poder del singular mundo imaginativo de Roussel. Raymond Roussel y la República de los Sueños, extenso estudio de la vida y la obra de Roussel, traza la extraña evolución de los métodos de escritura de Roussel y describe las peculiaridades de una vida estructurada tan obsesivamente como su obra. El relato que el poeta inglés Mark Ford (1962) nos ofrece es al mismo tiempo cautivador, desgarrador y muy literario. ¿Acaso podrían haber inventado Proust o Nabokov un personaje tan peculiar e inolvidable como el dandy exquisito y escritor compulsivo al que este libro da vida?",es,408,,,,2004
Rosshalde,Hermann Hesse,Fiction,"El lector admirará esta pequeña obra maestra en la que el arte narrativo de Hermann Hesse está llevado a su más alta expresión. Se trata de su cuarta novela, escrita pocos años después de su primer viaje a Oriente. En ella cuenta la historia de Johann Veraguth, un pintor de renombre mundial cuyas fama y fortuna parecían destinadas a procurarle una vida idílica en Rosshalde, su magnífica y misteriosa residencia. Sin embargo deberá luchar denodadamente para no quedar atrapado en las tribulaciones de su rutina doméstica.",es,182,,,SUDAMERICANA,2012-12-01
Tarzan of the Apes,Edgar Rice Burroughs,Fiction,"En ""Tarzán de los Monos"", de Edgar Rice Burroughs, un niño inglés huérfano llamado John Clayton es criado por simios en la selva africana tras la muerte de sus padres. Conocido como Tarzán, crece con una fuerza y agilidad increíbles y una profunda conexión con la naturaleza. Cuando se encuentra por primera vez con otros humanos, entre ellos la bella Jane Porter, debe enfrentarse a su identidad y a su lugar en ambos mundos.",es,411,,,SAMPI Books,2024-11-20
The Ragged Trousered Philanthropists,Robert Tressell,Literary Criticism,,en,224,,,,1969
Sons and Lover,D. H. Lawrence,Literary Collections,,es,0,5,1,,2011-12-29
Death in Venice,Thomas Mann,Fiction,"Celebrated novella of a middle-aged German writer's tormented passion for a Polish youth met on holiday in Venice, and its tragic consequences. New translation with extensive commentary.",en,83,,,Courier Corporation,2012-02-29
The Charwoman's Daughter,James Stephens,Fiction,"James Stephens (1882-1950) was an Irish novelist and poet. Stephens wrote many retellings of Irish fairy tales. ""The Charwoman's Daughter"" originally appeared in 1912.",en,126,,,Wildside Press LLC,2008-04-01
Ethan Frome,Edith Wharton,Spanish language,,es,180,,,Editorial Montesinos,1981
Fantomas,Marcel Allain,Fiction,"Una amenaza sobrevuela París. Una figura sombría, espectral, capaz de cometer las peores villanías que se puedan imaginar. Un hombre sin identidad, con la pericia de convertirse en cualquiera; un maestro del disfraz, del robo, del secuestro, del chantaje, de la suplantación de identidades y del asesinato. Fantomas es, probablemente, el primer «supervillano» de la historia tal y como conocemos actualmente la denominación, el que siguió la estela de Arséne Lupin (creado por Maurice Leblanc seis años antes) pero llevándolo más lejos. Porque, aun siguiendo la estela de Arséne Lupin, desde el momento de su publicación, en febrero de 1911, Fantomas (y las treinta y una novelas en torno al personaje que rápidamente aparecieron) se convirtió en un fenómeno de masas, cuya popularidad trascendió todos los estratos sociales y culturales. Años más tarde, las películas de Louis Feuillade acabaron de encumbrar las hazañas del «rey de la noche» y de sus implacables enemigos, el inspector Juve y el periodista Jérôme Fandor. Y, hoy, al fin, podemos volver a leerlas y a disfrutar de ellas.",es,299,,,EDHASA,2024-05-29
Howard's End,E. M. Forster,Fiction,"Indagación sobre la capacidad del ser humano para establecer relaciones armónicas con su vida interior y el medio exterior, así como reflexión en torno a la posibilidad de salvación personal en una sociedad sumida en una crisis, la red de relaciones que une a las hermanas Helen y Margaret Schlegel (representantes del mundo liberal de la cultura y el pensamiento) con la familia Wilcox (exponente de la industria y del dinero, del pragmatismo y de la acción) crea las condiciones para la conciliación de actitudes antagónicas y aparentemente irreconciliables.",es,454,,,Alianza Editorial Sa,2005
Impressions of Africa,Raymoned Roussel,Fiction,"«Incluso para quienes se hayan aventurado antes en otros mundos fantásticos, Vorrh es como sumergirse en el mar por primera vez. Lean este libro y maravíllense».ALAN MOORE Más allá de la ciudad colonial de Essenwald se extiende un inmenso bosque, tal vez infinito, en el que habitan ángeles y demonios, guerreros y sacerdotes. Floresta mágica y sensible, el Vorrh retuerce el tiempo, absorbe las almas, borra la memoria y cuentan las leyendas que en su corazón se conserva intacto el mismísimo jardín del Edén. Ahora, un soldado rebelde inglés se propone ser el primero en atravesar su extensión y emprende el viaje armado solo con un extraño arco fabricado con la espina dorsal de su amante. Pero alguien que teme las consecuencias de su misión enviará para detenerlo a un implacable tirador nativo. Alrededor de ellos orbitarán decisivamente historias tan dispares como la de un cíclope criado por robots de baquelita o la de figuras históricas como Sarah Winchester, heredera del imperio del rifle, y el inclasificable escritor Raymond Roussel. Patrick Rothfuss y China Miéville, Alasdair Gray y Philip José Farmer, los más nuevos y los grandes maestros resuenan y se amplifican en esta novela exuberante y devoradora, una arrolladoramente original creación literaria que, ignorando las fronteras entre los géneros, combina sin fisuras el steampunk, el surrealismo y el terror gótico. Vorrh. El bosque infinito es de lejos lo mejor que le ha pasado a la fantasía en lo que va de siglo. Así que prepárense para adentrarse en él.",es,640,,,Siruela,2018-10-10
Three Lives,Gertrude Stein,Fiction,"""Three Lives"" by Gertrude Stein is a groundbreaking work that delves into the interconnected lives of three women—The Good Anna, Melanctha, and Lena. Stein's avant-garde narrative style challenges traditional storytelling, offering a unique exploration of identity, relationships, and societal norms. Published in 1909, this influential work foreshadows Stein's later contributions to modernist literature and remains a captivating study of character psychology within a shifting cultural landscape.",en,235,,,Strelbytskyy Multimedia Publishing,2024-01-09
Martin Eden,Jack London,Biography & Autobiography,"Martin Eden es una novela autobiográfica y naturalista del estadounidense Jack London, publicada por entregas entre 1908 y 1909 en The Pacific Monthly y en forma de libro en ese último mismo año. Es la historia de un proletario, un muchacho de pueblo que se hace marinero y, a los veinte años, descubre en Oakland la cultura al ser acogido en una refinada familia burguesa, y se esfuerza en lograr una, como en Jude el oscuro de Thomas Hardy, mediante una formación autodidacta. Martin intenta convertirse en un escritor al principio con la ayuda de la hija burguesa de la familia, Ruth Morse, de la que está enamorado, pero esta luego lo abandona al ver que no alcanza del todo sus objetivos; Eden sin embargo persiste, lee mucho, escribe aunque los editores rechazan sus relatos y novelas, y al fin logra el reconocimiento y la fortuna; pero se desespera por haber obtenido solo un éxito a medias que le parece peor que un fracaso y se arroja al mar, sumergiéndose tan profundamente que ya no puede salir a flote, ya que, aunque había obtenido el respeto de la sociedad burguesa, había desarrollado un profundo rencor contra ella y se había cansado de su trabajo y del amor no correspondido. Siente que no se le valora por sí mismo o por su trabajo, sino solo por su fama. Y se siente extraño al subir a otra vez a un barco: ya no es el que era. Así que dona su fortuna a sus amigos de la clase trabajadora y se suicida. Incluso este suicidio sería una indicación autobiográfica previa, ya que el propio London se habría suicidado, aunque si lo hizo o no todavía hoy resulta ser algo muy controvertido.",es,352,,,Editorial Verbum,2020-12-22
Strait is the Gate,Andre Gide,Fiction,"""Strait is the Gate"", first published in 1909 in France as ""La Porte etroite"", is a novel about the failure of love in the face of the narrowness of the moral philosophy of Protestantism. --- André Gide (1869 - 1951) was a French author and winner of the Nobel Prize in literature in 1947. Gide's career spanned from the symbolist movement to the advent of anticolonialism in between the two World Wars. Gide's work can be seen as an investigation of freedom and empowerment in the face of moralistic and puritan constraints, and gravitates around his continuous effort to achieve intellectual honesty. His self-exploratory texts reflect his search of how to be fully oneself, without at the same time betraying one's values... --- ""For Gide was very different from the picture most people had of him. He was the very reverse of an aesthete, and, as a writer, had nothing in common with the doctrine of art for art's sake. He was a man deeply involved in a specific struggle, a specific fight, who never wrote a line which he did not think was of service to the cause he had at heart."" (Francois Mauriac)",en,114,4.5,2,Mondial,2007
