title,author,categories,description,language,pageCount,averageRating,ratingsCount,publisher,publishedDate
Girl with Green Eyes,Edna O'Brien,Fiction,"UN ACONTECIMIENTO LITERARIO La última novela de la autora de Las chicas de campo , ganadora del premio Especial Femina Extranjero 2019 y el premio David Cohen 2019 por el conjunto de su obra: su novela más ambiciosa, comprometida y estremecedora. UNO DE LOS MEJORES LIBROS DEL SIGLO XXI SEGÚN THE IRISH TIMES «Un libro valiente sobre un espíritu valiente.» J. M. Coetzee «La escritora de lengua inglesa con más talento de nuestros días.» Philip Roth «Tiempo atrás fui una niña, pero ya no». Así empieza la nueva y sorprendente novela de Edna O'Brien, quien con más de ochenta años ha encontrado la fuerza y la valentía para viajar a Nigeria y entrevistar a varias de las niñas que fueron víctimas de Boko Haram. Su estremecedor testimonio ha inspirado esta novela al tiempo desgarradora y luminosa: la historia de Maryam, que es secuestrada junto con sus compañeras del colegio, encarcelada, violada y obligada a casarse con un desconocido; que debe huir con su bebé y su amiga hasta llegar fi nalmente a reencontrarse con su madre en la aldea, donde la esperan nuevas desventuras aún más sinuosas. O'Brien nos lleva sin aliento por cada página: ansiamos, sufrimos y nos conmovemos con su heroína, y la prosa es deslumbrante e hipnótica como esa luna que mira Maryam desde su celda, símbolo de la esperanza y la redención a pesar de todo. Pues esta es una historia de superación, de amor, amistad y solidaridad, en la que de un modo u otro podemos ver refl ejadas nuestras propias luchas. La crítica ha dicho: «Una novela dura, escrita casi a latigazos y [...] difícil que conviene leer.» Lourdes Pérez (directora El Diario Vasco) «La mayoría de los buenos escritores prefieren ser considerados no por lo que son sino por lo que escriben. La chica, el asombroso tour de force que O'Brien escribió con ochenta y tantos años, es un salto audaz e imaginativo [...] y una experiencia que te transporta lejos, profundamente empática e iluminadora. ¡Léanla! [...] Es una pura maravilla.» Richard Ford «Sería una ofensa para O'Brien reducir la literatura a un mensaje. La chica es un ejemplo perfecto de lo que debería ser la ficción: un acto de imaginación empática.» Charles Taylor, LA Review of Books «Una nueva novela tan sólida como la carrera dorada de esta enorme autora irlandesa. [...] Con su pluma madura, precisa, hondamente literaria, limpia de sobras y adornos, O'Brien logra introducirnos en el infierno moral con un, sin embargo, suave cartel de bienvenida.» Berna González Harbour, Zenda «Una novela con grandes dosis de dureza, pero imprescindible y, sobre todo, con una mirada repleta de esperanza.» Harper's Bazaar «O'Brien logra inyectar suaves dosis de humanidad con una calidad literaria a prueba de terrorismo.» Berna González Harbour, El País «Un relato estremecedor. [...] Una aventura de amor y solidaridad, de una lucha permanente que busca otorgarle un sentido a la experiencia que les toca vivir.» Diego Gándara, La Razón «La habilidad de O'Brien para habitar mentes de sus personajes y elaborar frases virtuosas hace de esta una lectura inmensamente dolorosa. [...] Es la persona ideal para contarnos esta verdad desgarradora.» Francine Prose, The New York Times «No hay autocompasión en la escritura de O'Brien, solo la secuencia de hechos. Así, sus historias tienen el poder universal propio del mito». Florence Noiville, Le Monde",es,226,,,LUMEN,2019-09-19
The Garden of Finzi-Continis,Giorgio Bassani,Fiction,"En la ciudad de Ferrara, cuando la comunidad judía vive amenazada por el antisemitismo del gobierno fascista, los Finzi-Contini—una familia judía de abolengo—llevan una vida apartada en una lujosa villa, rodeada por un jardín majestuoso. Alberto y su hermana Micòl, los hijos de la familia, deciden invitar a algunos amigos a su casa, después de que a muchos de ellos los hayan expulsado del club de tenis de la ciudad. El protagonista de la historia, un joven judío de clase media, accede así a esta hermética comunidad—aparentemente inmune a las leyes raciales—, en cuyas reuniones convergen la política y la vida privada, y aflora el amor entre el muchacho y la joven Micòl. Sin embargo, el curso de la historia parece arrastrarlos hacia un destino funesto y abocarlos a precipitarse al abismo que se abre bajo sus pies. Pocas novelas italianas del siglo xx han ocupado un lugar tan especial en el corazón de los lectores como ' El jardín de los Finzi-Contini', una conmovedora historia que entrelaza la suerte individual y colectiva de Italia en los albores de la Segunda Guerra Mundial. ""Su obra maestra. Una historia de amor juvenil escrita con un dibujo portentoso de caracteres en el que hasta los menores de ellos están trazados con buril"". José María Guelbenzu, El País ""Una novela que se articula en torno a una voz narradora anónima que nos cuenta su mirada de la alta burguesía judía de Ferrara, su mirada de hijo de la clase media y su compromiso entre sentimental y social con esa clase"". Ernesto Ayala-Dip, El Correo Español ""Una de las obras clave de la novelística italiana del siglo XX, y también de la literatura europea"". Jorge de Vivero, Diario de Pontevedra",es,252,,,Acantilado,2017-11-02
Stranger in a Strange Land,Robert A. Heinlein,Fiction,"El ingeniero en robótica Dan Davis parece que ha conseguido por fin la invención de su vida: un robot casero con habilidades extraordinarias, destinado a cambiar el rutinario paisaje del ama de casa para siempre. Pero entonces, su socio y amigo Miles, y su novia, Belle, le traicionan arrebatándole la empresa que tanto le costó levantar. Borracho, engañado y confundido, es criogenizado durante treinta años para volver a la vida en 2000. Pero cuando despierta nada es lo que esperaba, la ingeniería no funciona como antes ya que sus inventos cambiaron el mundo de una manera radical... Aunque existe la posibilidad de viajar en el tiempo, lo que le abre un abanico de opciones que nunca hubiera imaginado.",es,216,,,La Factoría de Ideas,2012-02-01
Franny and Zooey,J. D. Salinger,Fiction,"Por expreso deseo del autor, no está permitido que la editorial aporte en su material promocional ningún tipo de texto adicional, información biográfica, cita o reseña relacionados con esta obra. El lector interesado podrá, no obstante, encontrar abundante información al respecto en internet.",es,155,,,Alianza Editorial,2020-04-23
A Severed Head,Iris Murdoch,Fiction,"A novel about the frightfulness and ruthlessness of being in love, from the author of the Booker Prize-winning novel The Sea, The Sea Martin Lynch-Gibson believes he can possess both a beautiful wife and a delightful lover. But when his wife, Antonia, suddenly leaves him for her psychoanalyst, Martin is plunged into an intensive emotional reeducation. He attempts to behave beautifully and sensibly. Then he meets a woman whose demonic splendor at first repels him and later arouses a consuming and monstrous passion. As his Medusa informs him, “this is nothing to do with happiness.” A Severed Head was adapted for a successful stage production in 1963 and was later made into a film starring Claire Bloom, Lee Remick, Richard Attenborough, and Ian Holm.",en,199,,,Penguin,1976-11-18
Faces in the Water,Janet Frame,Fiction,"La joven Istina Movet está ingresada en un hospital mental. Poco importa lo que haya hecho para llegar ahí, porque, una vez dentro, ya no se la considera una persona; ahora es un ser sin derechos ni dignidad; se convierte en un número sometido a la estricta jerarquía del centro en la que los doctores son dioses indiferentes, y las enfermeras, sus despiadados brazos ejecutores. La que había sido una mujer ahora es un ser aislado, desamparado ante el delirio y el maltrato, siempre bajo la amenaza de ser sometida a la temida tortura del electroshock y a la solución final de la lobotomía cerebral. Janet Frame empezó a escribir Rostros en el agua (1961) por sugerencia de su psiquiatra como unas memorias de su traumático paso por varios manicomios de Nueva Zelanda, pero pronto la historia se le fue de las manos, se desbordó y, navegando en la ficción, se convirtió en el clásico inolvidable que es hoy, y ella, en la más importante escritora neozelandesa.",es,256,,,Trotalibros Editorial,2022-02-16
Solaris,Stanislaw Lem,Fiction,"El astronauta Kelvin se enfrenta a una nueva modalidad de agresión, una especie de enorme inteligencia oceánica que ocupa el planeta Solaris... Éste es el punto de partida de una alegoría de la condición humana, condenada a no obtener jamás respuestas definitivas a su ansia de conocimiento. Stanislav Lem ha escrito una novela ecléctica, en que conviven la ciencia ficción, el misterio y el amor en un ambiente denso e inquietante, repleto de imágenes evocadores y pinceladas de ironía que la han consolidado como un clásico de la literatura fantástica.",es,240,,,,2008
Cat and Mouse,Gunter Grass,Fiction,"La crónica apasionada de unas adolescencias quebradas por la guerra, que les hace salir de su mundo juvenil para enfrentarse con la catástrofe de un entorno en conflicto y en descomposición. En El gato y el ratón encontramos el mismo escenario de obras anteriores de Günter Grass, Danzig; un periodo de tiempo que ya había tocado 1939-1945 y un grupo de personajes que ya había aparecido en otros de sus libros. Sin embargo, hay un elemento que por primera vez trata en extensión: el amor. El grupo de adolescentes que en el primer verano nadan hasta un barco semihundido y lo convierten en mítica isla donde fantasear aventuras personales es el mismo que muy poco tiempo después, recién abandonado el pantalón corto, tendrá que ir al frente. Una novela breve en la que Grass bucea el mundo dolorido de la adolescencia de manera magistral. La crítica ha dicho: «En El gato y el ratón se narra de manera magistral el dolorido mundo de la adolescencia: el apasionado relato de la juventud quebrada por la guerra y enfrentada con la catástrofe de un entorno en descomposición. [...] Grass vuelve a arremeter contra la sociedad alemana y refleja una vez más su propio desarraigo, la sensación de sentirse extranjero en su propio país, un sentimiento que fue el detonante de su carrera literaria.» La Voz de Galicia «Un libro tentador, elocuente, extraño y extrañamente conmovedor, lleno de escenas notables, de una tragicomedia vitalidad y de una visión trascendental.» Kirkus Reviews «Un autor que une a sus grandes condiciones literarias una actitud ética ante la vida que lo inclina a revelar la hipocresía y los intereses ruines del poder a lo largo de la historia.» Ernesto Sábato «Grass escribe con furia, amor, desprecio, sentido de la comedia y de la tragedia... y todo con una conciencia implacable.» John Irving «Por haber pintado el rostro olvidado de la historia en fábulas de una alegría con tintes negros. Grass emprende la amplia tarea de revisar la historia de su tiempo recordando a los ignorados y olvidados: las víctimas, los perdedores y las mentiras que la gente desea olvidar porque una vez creyó en ellas.» Academia Sueca del Premio Nobel de Literatura (1999) «El secreto de Grass radica en el equilibrio precario y único que ha conseguido crear entre su anárquica fuerza imaginativa y su raciocinio artístico superior.» Hans Magnus Enzensberger «Un autor que se ha hecho responsable de forma ejemplar de la credibilidad alemana en el mundo.» Adolf Muschg «Grass escribe como testigo de su época. Su proyecto literario se erige contra el olvido y el silenciamiento del pasado.» Cecilia Dreymuller",es,131,,,ALFAGUARA,2016-09-15
The Prime of Miss Jean Brodie,Muriel Spark,Literary Criticism,,es,180,,,,2006
Catch-22,Joseph Heller,Fiction,"Un clásico moderno absolutamente rompedor sobre el sinsentido de la guerra en una nueva edición con prólogo de Laura Fernández. Trampa-22 es uno de los mejores libros del siglo xx y ha sido recientemente adaptado como miniserie televisiva protagonizada por George Clooney y Christopher Abott. Durante la Segunda Guerra Mundial, en el hospital de la base norteamericana de una minúscula isla italiana, un piloto de bombardero llamado Yossarian finge estar loco. Quiere evitar a toda costa perder la vida en su próxima misión aérea y regresar a casa. ¿Por qué demonios intentan todos matarle desde abajo?, se pregunta cada vez que lanza una bomba. Yossarian intenta demostrar que está loco pero cae en la «trampa 22»: una absurda y perversa regla militar que afirma que aquellos que alegan locura para no ir a la guerra son los más cuerdos. Y si estás cuerdo, estás sano, así que... ¡no te queda otra! Publicada originalmente en 1961, Trampa 22 es sin lugar a dudas una de las obras maestras más divertidas y celebradas de todos los tiempos y una piedra angular de la tradición literaria norteamericana, que le ha valido estar en las listas de los mejores libros del siglo xx. El lector se sumergirá en una ráfaga de situaciones absurdas y diálogos delirantes que subrayan la estupidez de la guerra y del ser humano. Y es que «el infierno somos, y hemos sido siempre, nosotros», apunta Laura Fernández en el prólogo. «Si iba a describir un infierno, sería uno rabiosamente divertido. Porque así de ridículo es el mundo. [...] para que esta humanidad trate de aprender algo de sí misma.» Críticas: «No hay ningún libro como este [...] sorprendentemente poderoso.» Norman Mailer, Esquire « Trampa 22 es la única novela bélica que he leído que tiene sentido.» Harper Lee «Novela bomba [...]. Heller no solo descubrió ""el lado gracioso"" de la Segunda Guerra Mundial, sino que, además, anticipó las horriblemente hilarantes alucinaciones de Vietnam abriendo paso y escotillas para soltar absurdistas y entrópicos como Vonnegut, Berger, Kesey, Barthelme, Brautigan, Pynchon, Elkin, Friedman y Hunter Thompson y, más cerca, Wallace, Saunders y Palahniuk.» Rodrigo Fresán, Babelia, El País «Una de las obras más terriblemente divertidas en el uso del lenguaje [...]. Explosiva, implacable, subversiva, brillante.» Robert Brustein, The New Republic « Trampa 22 es una novela que nos recuerda una vez más todo aquello que hemos dado por supuesto en nuestro mundo y que no deberíamos, la locura que intentamos que pase desapercibida, las decepciones y las mentiras que no tenemos la voluntad de discernir de la verdad.» John W. Adridge, The New York Times Review «A mi parecer, en los últimos cincuenta años ha habido dos grandes novelas norteamericanas. Trampa 22 es una de ellas.» Stephen King, Entertainment Weekly «Esta no es meramente la mejor novela norteamericana que surgió de la Segunda Guerra Mundial, es la mejor novela norteamericana que ha surgido en años de cualquier lugar.» Nelson Algren, The Nation «Lo que tienen en las manos [...] es un monumento [...] hecho de páginas y personajes [...] suculentamente delirantes.» Laura Fernández",es,617,,,RANDOM HOUSE,2019-11-07
The Violent Bear It Away,Flannery O'Connor,Fiction,"En este volumen se reúnen todos los relatos de Flannery O'Connor, tanto los que publicó en vida como los que dejó inéditos, muchos de los cuales nunca se habían traducido al castellano. El genio lúcido, doloroso y atormentado de Flannery O'Connor alcanza sus más altas cimas en el cuento, género que cultivó ininterrumpidamente desde sus años de estudiante hasta su prematura y trágica muerte. Las historias de este libro hiriente y sobrecogedor tienen como escenario los pueblos y las tierras del sur de Estados Unidos, especialmente su Georgia natal, un mundo decrépito y en ruinas cuyo secular abandono y pobreza ancestral aparecen marcados por la violencia y el odio. Pero, más allá de la sordidez, los conflictos raciales, el asfixiante peso de la religión y la frustrada lucha por la libertad, hay siempre en los cuentos de Flannery O'Connor una extraña belleza, una íntima exposición moral de la condición humana que trasciende la anécdota. Comparada a menudo con William Faulkner o Carson McCullers, con quienes forjó lo que se ha llamado el «gótico sureño», Flannery O'Connor es una de las narradoras imprescindibles de la literatura norteamericana del siglo XX. La crítica ha dicho... «Un personaje y una escritora absolutamente magistral. [...] Una autora que se seguirá leyendo siempre. Es tan buena que te lees los cuentos de a poco para no acabártelo del todo. Súper recomendable.» Carlos Zanón, Babelia «Flannery O'Connor deja al lector paralizado, conmovido y profundamente impresionado por un talento literario de una singularidad y grandeza únicas.» Sunday Telegraph «Sus cuentos son duros, imaginativos, están vivos.» The Observer «No fue solo la mejor escritora de su época y país: expresó algo secreto sobre el sur de los Estados Unidos, con ese talento extraordinario para mostrar el espíritu real de una cultura. Fue una genia.» The New York Times «Una artista incomparable que escribió algunos de los mejores relatos en nuestro idioma.» Newsweek «Una colección magnífica de una gran escritora.» Hermione Lee, The Independent «Un corpus magistral, una de las cimas de la literatura del siglo xx.» Juan Manuel de Prada, ABC «Hay un antes y un después de leer a Flannery O'Connor.» Carolina Esses, La Nación «La obra de Flannery O'Connor constituye una de esas felices rarezas literarias que hará las delicias de quienes la frecuenten.» Miguel Lorenci, La Voz de Galicia «O'Connor enfrenta a los lectores a situaciones intrascendentes a primera vista, pero que terminan mostrando la complejidad de lo más nimio y, por ende, resultando grotescas.» José Antonio Gurpegui, El Cultural",es,605,,,LUMEN,2010-11-17
How It Is,Samuel Beckett,Fiction,"""Watt"" es una novela experimental, filosófica, cómica e inclasificable. Su protagonista, Watt, un desharrapado del que apenas llegamos a saber nada, pasa dos años como criado en la casa de un enigmático y caprichoso terrateniente, en un ambiente de tensión opresiva, que acaba por resquebrajar los esquemas mentales de Watt.",es,292,,,Ediciones Cátedra,2023-10-19
Our Ancestors,Italo Calvino,Literary Criticism,"Highlights Calvino's fascination with folk tales, knights, social & political allegories, & science fiction.",en,260,,,Univ of South Carolina Press,1993
The Country Girls,Edna O'Brien,Fiction,"UN ACONTECIMIENTO LITERARIO La última novela de la autora de Las chicas de campo , ganadora del premio Especial Femina Extranjero 2019 y el premio David Cohen 2019 por el conjunto de su obra: su novela más ambiciosa, comprometida y estremecedora. UNO DE LOS MEJORES LIBROS DEL SIGLO XXI SEGÚN THE IRISH TIMES «Un libro valiente sobre un espíritu valiente.» J. M. Coetzee «La escritora de lengua inglesa con más talento de nuestros días.» Philip Roth «Tiempo atrás fui una niña, pero ya no». Así empieza la nueva y sorprendente novela de Edna O'Brien, quien con más de ochenta años ha encontrado la fuerza y la valentía para viajar a Nigeria y entrevistar a varias de las niñas que fueron víctimas de Boko Haram. Su estremecedor testimonio ha inspirado esta novela al tiempo desgarradora y luminosa: la historia de Maryam, que es secuestrada junto con sus compañeras del colegio, encarcelada, violada y obligada a casarse con un desconocido; que debe huir con su bebé y su amiga hasta llegar fi nalmente a reencontrarse con su madre en la aldea, donde la esperan nuevas desventuras aún más sinuosas. O'Brien nos lleva sin aliento por cada página: ansiamos, sufrimos y nos conmovemos con su heroína, y la prosa es deslumbrante e hipnótica como esa luna que mira Maryam desde su celda, símbolo de la esperanza y la redención a pesar de todo. Pues esta es una historia de superación, de amor, amistad y solidaridad, en la que de un modo u otro podemos ver refl ejadas nuestras propias luchas. La crítica ha dicho: «Una novela dura, escrita casi a latigazos y [...] difícil que conviene leer.» Lourdes Pérez (directora El Diario Vasco) «La mayoría de los buenos escritores prefieren ser considerados no por lo que son sino por lo que escriben. La chica, el asombroso tour de force que O'Brien escribió con ochenta y tantos años, es un salto audaz e imaginativo [...] y una experiencia que te transporta lejos, profundamente empática e iluminadora. ¡Léanla! [...] Es una pura maravilla.» Richard Ford «Sería una ofensa para O'Brien reducir la literatura a un mensaje. La chica es un ejemplo perfecto de lo que debería ser la ficción: un acto de imaginación empática.» Charles Taylor, LA Review of Books «Una nueva novela tan sólida como la carrera dorada de esta enorme autora irlandesa. [...] Con su pluma madura, precisa, hondamente literaria, limpia de sobras y adornos, O'Brien logra introducirnos en el infierno moral con un, sin embargo, suave cartel de bienvenida.» Berna González Harbour, Zenda «Una novela con grandes dosis de dureza, pero imprescindible y, sobre todo, con una mirada repleta de esperanza.» Harper's Bazaar «O'Brien logra inyectar suaves dosis de humanidad con una calidad literaria a prueba de terrorismo.» Berna González Harbour, El País «Un relato estremecedor. [...] Una aventura de amor y solidaridad, de una lucha permanente que busca otorgarle un sentido a la experiencia que les toca vivir.» Diego Gándara, La Razón «La habilidad de O'Brien para habitar mentes de sus personajes y elaborar frases virtuosas hace de esta una lectura inmensamente dolorosa. [...] Es la persona ideal para contarnos esta verdad desgarradora.» Francine Prose, The New York Times «No hay autocompasión en la escritura de O'Brien, solo la secuencia de hechos. Así, sus historias tienen el poder universal propio del mito». Florence Noiville, Le Monde",es,226,,,LUMEN,2019-09-19
To Kill a Mockingbird,Harper Lee,Young Adult Fiction,"Uno de los grandes clásicos cabecera del siglo XX adaptada a novela gráfica. « Uno es valiente cuando, sabiendo que la batalla está perdida, lo intenta a pesar de todo y lucha hasta el final, pase lo que pase. Uno gana raras veces, pero alguna vez gana.» Matar a un ruiseñor es una de esas historias inmortales que se te pegan al corazón y te sacuden la conciencia. Es la historia de dos hermanos que aprenden a ver el mundo con otros ojos; también es la historia del padre que todos querríamos tener: Atticus Finch. Un hombre de valentía insobornable que defiende hasta el final la idea de que ser diferente no significa indefectiblemente ser culpable. Un poderoso mensaje retratado con una ternura punzante que ha conquistado a 40 millones de lectores en todo el mundo y que ha traspasado, generación tras generación, las barreras de la edad y el tiempo. Esta novela gráfica, que captura magistralmente la esencia del gran clásico, nos brinda una nueva oportunidad para volver a creer en la justicia.",es,288,,,RANDOM COMICS,2018-11-22
"Rabbit, Run",John Updike,Fiction,"The first book in John Updike's award-winning 'Rabbit' series, with an afterword by the author It's 1959 and Harry 'Rabbit' Angstrom, one time high school sports superstar, is going nowhere. At twenty-six he is trapped in a second-rate existence - stuck with a fragile, alcoholic wife, a house full of overflowing ashtrays and discarded glasses, a young son and a futile job. With no way to fix things, he resolves to flee from his family and his home in Pennsylvania, beginning a thousand-mile journey that he hopes will free him from his mediocre life. Because, as he knows only too well, 'after you've been first-rate at something, no matter what, it kind of takes the kick out of being second-rate'. 'It is sexy, in bad taste, violent and basically cynical. And good luck to it' Angus Wilson, Observer 'That special polish, that brilliance; Updike is among the best' Malcolm Bradbury 'Brilliant and poignant ... By his compassion, clarity of insight, and crystal-bright rose, [Updike] makes Rabbit's sorrow his and our own' Washington Post",en,363,5,1,Penguin UK,2006-06-01
Promise at Dawn: A Memoir,Romain Gary,Biography & Autobiography,"A classic of modern French literature, the thrilling real-life story of the military hero, ambassador, ladies man, writer, and loving son ""I grew up in the certitude that one day I should help give back the earth to those who ennoble it with their courage and warm it with their love."" Promise at Dawn begins as the story of a mother’s sacrifice: alone and poor, she fiercely battles to give her son the very best. Romain Gary chronicles his childhood in Russia, Poland, and on the French Riviera and recounts his adventurous life as a young man fighting for France in World War II. But above all he tells the story of the love for his mother that was his life—their secret and private planet, their wonderland “born out of a mother’s murmur into a child’s ear, a promise whispered at dawn of future triumphs and greatness, of justice and love.”",en,337,,,New Directions Publishing,2017-10-31
