title,author,categories,description,language,pageCount,averageRating,ratingsCount,publisher,publishedDate
The Book of Evidence,John Banville,Fiction,"La perfecta introducción al universo Banville. «Una novela sorprendente, perturbadora» ( The New York Times Book Review), por el ganador del Premio Booker y del Premio Príncipe de Asturias de las Letras. «La belleza reside en cada una de las novelas de John Banville. En sus manos de orfebre tallador de palabras, este mundo extraño, a veces ajeno y siempre misterioso, se vuelve un lugar más habitable, hermoso, y el lector tiene la sensación de que al menos en ese transcurrir de páginas la vida merece la pena ser vivida. [...] No hay truco que valga. Banville es puro arte.» Inés Martín Rodrigo, ABC Freddie Montgomery es un científico de talento exiliado en una isla del Mediterráneo. Llegado el momento de saldar una deuda, su mujer y su hijo son retenidos como garantía de pago, y él regresa a Irlanda para conseguir fondos en una búsqueda que termina en el robo de un cuadro valioso y el asesinato de una joven. ¿El móvil del crimen? Ni la avaricia, ni la venganza. Ha matado porque «podía hacerlo»: es un asesino accidental como el que quizá todos llevamos dentro. Mientras espera juicio escribe esta confesión como un intento de presentar las pruebas, no ya de su inocencia, sino de los acontecimientos que lo han llevado a esa celda y han marcado el recorrido de su vida entera. La crítica ha dicho sobre el autor: «Cada creación suya atrae y deleita por la maestría en el desarrollo de la trama y en el dominio de los registros y matices expresivos, y por su reflexión sobre los secretos del corazón humano. » Declaración del Jurado del Premio Príncipe de Asturias de las Letras 2014 «El más grande escritor irlandés vivo -con el permiso de William Trevor- y el mejor estilista de la lengua inglesa.» Begoña Arce y Elena Hevia, El Periódico de Extremadura «Heredero de la literatura de Nabokov, destaca en su estilo la cuidada construcción de cada frase, la narración en primera persona y el humor negro.» Gabinete de Prensa de la Biblioteca Nacional de España «Uno de los escritores contemporáneos más inteligentes, más sensibles y más cultos en las letras universales... Un escritor universal que quedará en la historia de la literatura... Hemos premiado no a un hombre más, sino a un novelista esencial en el panorama contemporáneo de las letras universales.» Rosa Navarro Durán, La Nueva España (Jurado del Premio Príncipe de Asturias de las Letras 2014) «Banville logra algo que se le achaca y agradece a partes iguales: reproducir el estilo del maestro [Henry James], ese estilo preciso y audaz que es también el símbolo del escritor irlandés.» Andrés Seoane, El Cultural Reseñas: «Una gran obra en la que cada suave momento detona en voz baja para mostrar un mortífero destello interior.» Don DeLillo «La recomiendo como introducción a Banville.» Francisco García Pérez, La Opinión de Tenerife «No un relato policial, sino una novela psicológica fascinante y trabajada en cada línea.» Eduardo García, Diario de Mallorca «La obra de Banville es un monumento al ser humano desde la complejidad y la profunda oscuridad.» Eduardo García, La Opinión de Málaga «El nosequé nabokoviano; la sensación de ensoñación con la que discurre el relato... Los que tengan ese Banville bien fijada en la cabeza seguramente se lleven una pequeña alegría con el fallo del Premio Príncipe de Asturias de las Letras.» Luis Alemany, El País",es,192,,,ALFAGUARA,2014-10-22
Cat's Eye,Margaret Atwood,Fiction,"By the author of The Handmaid's Tale and Alias Grace Elaine Risley, a painter, returns to Toronto to find herself overwhelmed by her past. Memories of childhood - unbearable betrayals and cruelties - surface relentlessly, forcing her to confront the spectre of Cordelia, once her best friend and tormentor, who has haunted her for forty years. 'Not since Graham Greene has a novelist captured so forcefully the relationship between school bully and victim...Atwood's games are played, exquisitely, by little girls' LISTENER An exceptional novel from the winner of the 2000 Booker Prize",en,338,1,1,Hachette UK,2009-09-03
Foucault's Pendulum,Umberto Eco,Literary Criticism,"Umberto Eco reflexiona con maestría sobre la importancia de tener un enemigo. Todo el mundo necesita tener un enemigo, nos dice Umberto Eco, los países, los sistemas, cada uno de nosotros... Y si no existe el enemigo, hay que inventarlo, es una figura imprescindible, un antagonista que nos permite definir nuestra identidad y medir nuestro sistema de valores. Este ensayo extraordinario, cuya idea desarrollará después en su novela El cementerio de Praga, apareció en el volumen homónimo que recoge trece «textos de ocasión» según el propio Eco, publicado en Lumen el año 2012.",es,38,,,FLASH,2013-07-25
The Beautiful Room is Empty,Edmund White,Gay men,,es,289,,,,1995
Wittgenstein's Mistress,David Markson,,,en,280,,,,1995
The Satanic Verses,Salman Rushdie,,,en,517,,,,1989
Swimming Pool Library,Alan Hollinghurst,Fiction,"This controversial, darkly erotic novel of male homosexuality and promiscuity before the scourge of AIDS was ""easily one of the year's (1988) most important debuts"".",en,360,4,6,Vintage,1988
Oscar and Lucinda,Peter Carey,Fiction,"Una reflexión acerca de la democracia narrada a través de la relación de amistad entre un aristócrata francés y su criado. Basado en la vida de Alexis de Tocqueville, Parrot y Olivier en América es la hilarante crónica de una amistad imposible entre un señor y su criado. Olivier, alias lord Migraña, es el hijo enfermizo y traumatizado de una pareja de aristócratas supervivientes de la revolución francesa. Parrot, alias Loro, es hijo de un impresor inglés itinerante que siempre ha soñado con convertirse en artista, pero que ha terminado siendo criado. Cuando Olivier pone rumbo al Nuevo Mundo, con el pretexto de estudiar su sistema de prisiones y, de paso, para mantenerse a salvo de futuras revoluciones, Parrot es enviado con él como espía, protector, enemigo y contrapunto. A medida que la historia alterna las peripecias de ambos personajes y sus concepciones del mundo, Peter Carey examina la aventura de la democracia americana, en la teoría y en la práctica, con una inteligencia y una imaginación deslumbrantes.",es,384,,,RANDOM HOUSE,2011-10-06
Libra,Don DeLillo,Juvenile Nonfiction,"Detrás del asesinato de John F. Kennedy se esconde una compleja conspiración internacional cuya cabeza visible es Lee Harvey Oswald, pero detrás de Oswald hay un niño problemático con un atormentado mundo interior, un joven cuyos ideales entran constantemente en conflicto con la realidad que los niega.Libra es una especulación asombrosamente veraz, literariamente impecable y escalofriantemente convincente de los sucesos que desencadenaron el asesinato de Kennedy y de la atmósfera general de aquellos tormentosos años en que el derrumbamiento del gran sueño americano abrió la puerta al secretismo gubernamental. De esta época surgen los elementos conspirativos que caracterizan casi toda la obra de este lúcido intérprete de nuestro tiempo. Figuras reales mezcladas con personajes de ficción con verdadero virtuosismo e intrigas casi inverosímiles en una de las obras mayores de Don DeLillo, una novela que fascina desde la primera página. Escritor obsesivo con un proyecto literario de consciente continuidad, DeLillo es una de las más importantes voces narrativas de Estados Unidos.",es,496,,,,2005
The Player of Games,Iain Banks,Fiction,"Gurgeh era uno de los mejores jugadores de la Cultura, maestro reconocido de todos los tableros, y estrategias. Aburrido de su éxito y forzado por las circunstancias, Gurgeh se encontrará a sí mismo en el imperio de Azad, cruel y próspero, enfrentado al juego supremo, un elaborado reto modelado con tanta exactitud, de acuerdo con las reglas de la existencia, que el ganador del mismo es proclamado Emperador. Víctima de un chantaje, y sin verdaderas alternativas, Gurgeh se ve obligado a participar en él, enfrentándose al mayor de los desafíos y poniendo en peligro su propia vida.",es,398,,,La Factoría de Ideas,2012-02-01
Nervous Conditions,Tsitsi Dangarembga,,"Tambu, una campesina pobre de Zimbabue, pertenece, como la autora misma, a la generación que asistió al tramo final de las luchas contra el régimen de la minoría blanca que culminan, en 1980, con la formación del primer gobierno negro. La lucha de Tambu por acceder a una buena educación simboliza la trayectoria de una colectividad nacional que conoce cambios profundos en la transición entre las incertidumbres de la lucha contra el colonialismo y las incertidumbres de la independencia, en el marco de las tensiones entre tradición y modernización, entre africanismo y europeísmo, entre una situación tutelada y oprimida y una condición adulta y autónoma. A Tambu no le basta con superar las desventajas de la triple discriminación que padece, como pobre, como mujer y como negra: debe, además, aprovechar una educación europea para construir una personalidad africana. El libro ofrece así una visión del difícil futuro africano.",es,330,,,Intermón Oxfam Editorial,2010
Long Dark Tea Time of the Soul,Douglas Adams,Fiction,"Dirk Gently, detective holístico, tiene un método de trabajo basado en la interconexión entre todas las cosas. En esta novela, la inexplicable explosión que devasta una terminal del aeropuerto de Heathrow tiene relación con el misterioso cliente que acude a Dirk para que le proteja de una siniestra criatura de dos metros diez, de grandes ojos verdes, peluda y con cuernos. Pero Dirk llega con retraso a la casa de su cliente, que en el ínterin ha sido decapitado. La explicación es muy sencilla: Thor, el Dios del Trueno, está en Londres para dirimir una terrible disputa con su padre Odín, dios supremo del Valhalla, que ha decidido vender su alma inmortal a un abogado y una agente de publicidad. Y en tanto el titánico duelo entre los dioses no se decide, todo Londres se estremece al compás de sus celestiales iras. En el curso de las investigaciones, Dirk tropieza con obstáculos, pero ello no le impide trasladarse finalmente al gran salón del Valhalla. Allí se celebra un sorprendente banquete, y tal vez Dirk consiga poner las cosas en claro y resolver los enigmas de este mundo y del otro. Tras la aclamada serie de los Autoestopistas Galácticos, Douglas Adams creó un personaje que superaba, si cabe, su humor surrealista e ironía explosiva. Dirk Gently (excéntrico, inclasificable por excelencia de las absurdidades y paradojas del frenético y desbocado fin del siglo XX).",es,242,,,Anagrama,2016-11-09
Dirk Gently's Holistic Detective Agency,Douglas Adams,Fiction,"Dirk Gently es un detective muy peculiar. Sherlock Holmes afirmaba que cuando se ha eliminado lo imposible, lo que queda ?sea lo que sea- es la verdad. Dirk Gently, sin embargo, jamás elimina nada, y menos que nada, lo imposible. Y para resolver sus casos prefiere recurrir a la física cuántica antes que a las huellas dactilares. Así pues, cuando le encargan la búsqueda de un gato perdido, Dirk acaba encontrando dos fantasmas y un Monje Eléctrico venido de otra dimensión, y descubre un terrible secreto que puede acarrear la destrucción de la humanidad. También averigua la imposible, improbable, increíble y aterradora razón por la que un experto en ordenadores tuvo un sofá atascado en la escalera de su casa durante tres semanas. Pero ¿qué sucedió con el gato? El gato, infortunadamente, murió.",es,238,,,Anagrama,2006-04-18
The Radiant Way,Margaret Drabble,,"Tre kvinder, venner siden de mødtes som studerende i Cambridge i 1952, oplever 1980'erne i London som en tid fuld af omvæltninger i forhold til ægteskab, arbejde og åndeligt klima",da,363,,,,1992-01
Afternoon of a Writer,Peter Handke,Fiction,"Una personal indagación en las relaciones del hombre consigo mismo y con lo que está a su alrededor. Con motivo del 50 aniversario de Alfaguara, este título, cuyo autor ha sido galardonado con el Premio Nobel de Literatura 2019, ha sido elegido como uno de los 50 imprescindibles de la historia de la editorial. «... todo está ahí, y yo no soy nada.» Goethe, Torcuato Tasso Una tarde de diciembre, a la luz cambiante del ocaso, un escritor, sentado a su mesa de trabajo, decide dar un paseo por el mundo, deambular por patios, plazas y callejuelas, perderse por arrabales y volver a su casa amparado ya en la oscuridad. En el camino quedará una doble huella: la de la mirada hacia lo exterior y la de la duda que contempla lo que está dentro de sí. Pero todo será visto como si fuera la primera vez, como si al cerrar los ojos la realidad apareciera en su verdad más pura. Con La tarde de un escritor, Peter Handke, uno de los más grandes creadores en lengua alemana, prosigue su personal indagación en las relaciones del hombre consigo mismo y con lo que está a su alrededor. La crítica ha dicho: «Por un trabajo influyente que, con inventiva lingüística, ha explorado las periferias y la especificidad de la experiencia humana.» Jurado del Premio Nobel «Handke se ha vuelto un clásico. [...] Un escritor que traza con su aguda, implacable mirada, y su oído atento, los contornos precisos del aire.» El País «Handke pertenece a la camada intelectual de los que hacen de la escritura un testamento incendiario, una diatriba contra las convenciones.» Antonio Lucas, El Mundo «Peter Handke, justo ganador del Premio Nobel de Literatura 2019, es el escritor que consiguió que el mundo, no los personajes ni sus conciencias, hablara en monólogo interior y que supiéramos lo que el mundo pensaba y cómo pensaba.» Alejandro Gándara, El Cultural «El Premio Nobel -¡por fin!- que Peter Handke acaba de recibir es un reconocimiento y una recompensa a una obra destinada a perdurar durante mucho tiempo.» Eustaquio Barjau, ABC",es,59,,,ALFAGUARA,2010-11-25
The Black Dahlia,James Ellroy,Fiction,"Los Angeles, 15th January 1947. A beautiful young woman walks into the night and meets a horrific destiny. Five days later, her tortured body is found drained of blood and cut in half. The newspapers call her 'The Black Dahlia'. For two cops, what begins as an investigation becomes a hellish journey that takes them to the core of the dead girl's twisted life. And soon professional curiosity spirals into obsession... __________ 'A mesmerising study of the psycho-sexual obsession... extraordinarily well written' - The Times 'The outstanding crime writer of his generation' - The Independent 'A wonderful tale of ambition, insanity, passion and deceit' - Publishers Weekly",en,386,4.5,2,Random House,2011-10-31
The Passion,Jeanette Winterson,Fiction,"La primera colección de relatos de la desafiante y provocadora Jeanette Winterson, considerada por muchos como la Virginia Woolf contemporánea. Es costumbre de Jeanette Winterson desmontar el mundo tal y como lo conocemos para reinventarlo a imagen y semejanza de sus protagonistas. De los diecisiete cuentos aquí reunidos emergen geografías desconcertantes, emociones que resultan familiares y extrañas al mismo tiempo, caminos donde la imaginación juega con una escritura viva hasta la provocación. Los hombres y mujeres que llenan estas páginas se revelan como seres improbables pero siempre intrigantes, como el profesional que trabaja de soñador en una sociedad donde está prohibido dormir, las dos mujeres que se embarcan en una relación sexual caníbal, el infeliz que vive en una casa cuyas habitaciones se empeñan en desaparecer, o la niña que sueña con tener un conejo de pelo blanco y corazón negro que muerda a la gente que la ignora... personas que anda por el estrecho sendero que separa la libertad de la rutina, y que el talento de Winterson rescata para todos sus lectores. «Cada vez que tomas una decisión importante, hay una parte de ti que sigue viviendo esa otra vida que dejaste atrás.» Jeanette Winterson La crítica ha dicho sobre la novela... «Poético, emotivo, El mundo y otros lugares es una presentación del universo Winterson en pequeñas dosis.» Juan Manuel Freire, Dominical de El Periódico de Cataluña «Buena parte de los universos que hallamos en sus obras más extensas se dan cita en El mundo y otros lugares.» M. Ángeles Cabré, Babelia Y sobre la autora... «Winterson [...] a través de la heterodoxia de sus textos, dinamita categorías, vocabularios y convenciones tristes. Una escritora maravillosa.» Marta Sanz, Babelia «Jeanette Winterson es una fuerza desatada de la naturaleza. Ella sola es el cambio climático entero.» Carmen Morán Breña, El País «Mientras la mayoría de autores y autoras se limitan a regurgitar la imaginación de sus antecesores, [...] esta inglesa rebelde se pone la literatura por montera y la reinventa.» M. Ángeles Cabré, Babelia «Una autora de extraordinaria sensibilidad cuya obra es devota de Virginia Woolf.» Jacinto Antón, El País «Una escritora outsider de referencia en Inglaterra.» Esther L. Calderón, Divinity «Lo que es seguro es que Jeanette Winterson siempre podrá seguir evolucionando; evocar nuevos paisajes, nuevos cuerpos, nuevas personalidades, es parte de su naturaleza.» Harper's Bazaar",es,176,,,LUMEN,2015-11-05
The Pigeon,Patrick Suskind,Juvenile Nonfiction,,en,92,5,1,,1999
The Child in Time,Ian McEwan,Fiction,Stephen Lewis is shopping at the grocery stoer with his three-year old daughter Kate. She disappears without a trace and time as Stephen knows it ceases. Uncertainty and grief overwealm him and his wife as they drift apart until the passage of time--both forgiving and punishing--can bring them back to one another.,en,276,,,Penguin Group,1988
Cigarettes,Harry Matthews,Fiction,"A pesar de la luminosidad del ttulo, esta obra se inspira en la transgresin de una moral prudente, en una bsqueda peligrosa: el aprendizaje de la muerte, la profundidad imposible de ese cielo azul que nos atrae y repele al mismo tiempo. Londres, Pars, Barcelona, dibujan una topografa de la perdicin, un marco en el cual Troppman, a travs de borracheras, noches en blanco y extraas celebraciones, se va acercando hacia esa nueva forma de pureza, la comunin con la muerte gracias al descubrimiento iluminador de los srdido.",es,190,,,,1985
The Bonfire of the Vanities,Tom Wolfe,,,es,698,3,3,,1992
The New York Trilogy,Paul Auster,Fiction,"Un clásico contemporáneo y una de las obras que consolidaron a Paul Auster como best seller internacional. Tres caras de una misma historia con la que el escritor norteamericano reinventó el género policíaco. En La ciudad de cristal, Daniel Quinn, escritor de literatura policíaca, recibe una llamada telefónica de un desconocido que lo toma por un detective y le encarga un caso. En Fantasmas, un detective privado y el hombre al que debe vigilar juegan al escondite en un claustrofóbico universo urbano. En La habitación cerrada el protagonista debe confrontar los recuerdos de un amigo de la infancia cuando recibe la noticia de su desaparición.",es,340,,,Grupo Planeta Spain,2012-02-20
World's End,T. C. Boyle,Fiction,,en,540,,,,1991
The Enigma of Arrival,V. S. Naipaul,Fiction,"En 1920, un joven hindú deja su Trinidad natal para abrirse camino en la metrópolis, una nueva realidad que lo desconcierta y le obliga a buscar un lugar en el mundo. Una novela del Premio Nobel de Literatura V.S. Naipaul. Un joven hindú, nacido en Trinidad, llega a la antigua metrópoli y al enfrentarse a ese nuevo mundo descubre la necesidad y el placer de aprender de nuevo. El proceso de construcción de una mirada. Llegar presupone una preparación, unas expectativas; produce angustia y deseos. Llegar supone afrontar una separación previa, un desgarramiento, un tránsito, establecer vínculos nuevos. Ocasiona incomodidad y desconcierto, pero también enriquecimientos inesperados, hallazgos múltiples. Llegar, en fin, es transitar por un limbo que no está en el origen ni en el término del trayecto Reseña: «En El enigma de la llegada Naipaul reflexiona con hondura sobre el luminoso oficio de la escritura: una carta a uno mismo que vale tanto como una carta a un joven poeta.» Miguel Sánchez-Ostiz",es,430,,,DEBOLS!LLO,2016-11-25
The Taebaek Mountains,Jo Jung-Rae,History,"Worm-Time challenges conventional narratives of the Cold War and its end, presenting an alternative cultural history based on evolving South Korean aesthetics about enduring national division. From novels of dissent during the authoritarian era to films and webtoons in the new millennium, We Jung Yi's transmedia analyses unearth people's experiences of ""wormification""—traumatic survival, deferred justice, and warped capitalist growth in the wake of the Korean War. Whether embodied as refugees, leftists, or broken families, Yi's wormified protagonists transcend their positions as displaced victims of polarized politics and unequal development. Through metamorphoses into border riders who fly over or crawl through the world's dividing lines, they reclaim postcolonial memories buried in the pursuit of modernization under US hegemony and cultivate a desire for social transformation. Connecting colonial legacies, Cold War ideologies, and neoliberal economics, Worm-Time dares us to rethink the post-WWII consensus on freedom, peace, and prosperity.",en,374,,,Cornell University Press,2024-12-15
Beloved,Toni Morrison,,,en,0,,,,2021
Anagrams,Lorrie Moore,Fiction,"Benna Carpenter es cantante en un club nocturno y rehúye de su vecino Gerard, que la ama con locura. Benna Carpenter es profesora de aerobics para ancianos, le detectan un bulto en un pecho, escribe errados anagramas y está enamorada de Gerard, un músico que le rompe el corazón reiteradamente. Benna Carpenter es profesora universitaria, tiene una hija imaginaria y un amigo íntimo, Gerard, de quien descubre un poderoso secreto cuando ya es demasiado tarde. En Anagramas, su primera novela, Lorrie Moore despliega un agudo sentido del humor y un delicado manejo del lenguaje que serán característicos de toda su obra, y construye una suerte de laberinto de espejos que reflejan otras vidas posibles en una solapada estrategia para combatir la soledad y el abandono. Como si la vida no fuese otra cosa que intentar todas las combinaciones posibles con las letras que a cada uno le tocaron en gracia.",es,281,,,CANOPUS EDITORIAL DIGITAL SA,2024
Matigari,Ngugi wa Thiong'o,History,"Este libro reúne las conferencias de dos simposios celebrados en el invierno 2002-2003 en la Facultad de Filosofía y Letras de la Universidad Nacional Autónoma de México. El primero llevaba el título de ""Alemania y México después de la Guerra Fría"", mientras que el tema del segundo era ""Caminos a la modernidad: diferentes construcciones de la Nación"". Los simposios fueron organizados en el marco de las actividades de la Cátedra Extraordinaria ""Guillermo y Alejandro de Humboldt"", su lectura contribuirá a la mutua comprensión de la realidad social y política de ambos países.",es,106,,,UNAM,2004
Marya: A Life,Joyce Carol Oates,Biography & Autobiography,"These twenty-five interviews with Joyce Carol Oates from early in her career to the present are the first such collection to be published. In these conversations from sources as diverse as major news magazines and small scholarly journals, Oates candidly talks about her work, her concepts of literature, her methods of writing, and many other topics. Throughout this anthology, Oates discusses how her writing paints a modern panorama of American life. Oates described her vast canvas to an interviewer: """"I could not take the time to write about a group of people who did not represent, in their various struggles, fantasies, unusual experiences, hopes, etc., our society in miniature."""" She also comments upon her responsibility as an artist """"to bear witness"""" to certain aspects of society. In this light, she responds to criticisms that violence seems to dominate her work by noting that """"one simply cannot know strengths unless suffering, misfortune, and violence are explored quite frankly by the writer.""""In addition to discussing her works---from her first book By the North Gate (1963) to her most popular novel You Must Remember This (1987)---this prolific writer also answers questions about her writing habits. These interviews, spanning nineteen years, reveal a vivid portrait of Joyce Carol Oates writing as the conscience of society, as the creator of memorable prose and poetry, and as the artist deeply committed to a unique vision.",en,216,,,Univ. Press of Mississippi,1989
Watchmen,Alan Moore,,,es,416,,,,2014
